{
  "pack": "garrytan/gstack",
  "repoUrl": "https://github.com/garrytan/gstack",
  "resolvedRef": "main",
  "resolvedSha": "ad8400543cd9ce8d07641362db48d44a95417e33",
  "resolvedAt": "2026-08-26",
  "license": {
    "status": "recorded",
    "sourceUrl": "https://github.com/garrytan/gstack/blob/ad8400543cd9ce8d07641362db48d44a95417e33/LICENSE",
    "blobSha": "35029511144443297cad2d26e4bac17d0e352f93"
  },
  "catalogs": [
    "catalogs/ceo.json",
    "catalogs/engineering.json"
  ],
  "skills": [
    {
      "path": "autoplan/SKILL.md",
      "blobSha": "b1b651bdafa08751ae6985eb08148321e6101f56"
    },
    {
      "path": "benchmark-models/SKILL.md",
      "blobSha": "5c39c2302bd9220a14803c35a7d93537d2a99fb8"
    },
    {
      "path": "benchmark/SKILL.md",
      "blobSha": "ae893b05e34be2271e7cf11ea6f6833b255b1379"
    },
    {
      "path": "browse/SKILL.md",
      "blobSha": "d8f70c813fdedd94a8351408526a4b1cabff8747"
    },
    {
      "path": "browser-skills/hackernews-frontpage/SKILL.md",
      "blobSha": "aa90258f6b9332fff82ed1903f9268181d9d7873"
    },
    {
      "path": "canary/SKILL.md",
      "blobSha": "bacb1335e20b61f47777e9dcc55d45d53b2d0288"
    },
    {
      "path": "careful/SKILL.md",
      "blobSha": "5dae5e97285b357c392f8b6c00e680b9a523d4c2"
    },
    {
      "path": "codex/SKILL.md",
      "blobSha": "40cd0cab7d30fbffa3db4b5b1824e75113cb3717"
    },
    {
      "path": "context-restore/SKILL.md",
      "blobSha": "31db0e8f827c3be3cc7d6d1257b4ba1bba41f419"
    },
    {
      "path": "context-save/SKILL.md",
      "blobSha": "4ef9f249d6ad315f84642a1dbe9e30f06f5b395d"
    },
    {
      "path": "cso/SKILL.md",
      "blobSha": "749c72d35055aec75b6c29f1c12bfb07839cd105"
    },
    {
      "path": "design-consultation/SKILL.md",
      "blobSha": "7917a7de36be84e589e8b227828d4c3979d8500b"
    },
    {
      "path": "design-html/SKILL.md",
      "blobSha": "72ebf54454eb3182dcb47f250b2cf16744f1299c"
    },
    {
      "path": "design-review/SKILL.md",
      "blobSha": "41e30355a4d6b6bd62f293c3f5ea312a792aea09"
    },
    {
      "path": "design-shotgun/SKILL.md",
      "blobSha": "f43c0f7385bfa18bfaedc34ab9df2f949704aa25"
    },
    {
      "path": "devex-review/SKILL.md",
      "blobSha": "a5e1d5f9401d080a2bbc130387ea24bcec13f895"
    },
    {
      "path": "diagram/SKILL.md",
      "blobSha": "1bd399828c96f311e7eaacc4549753b32e789159"
    },
    {
      "path": "document-generate/SKILL.md",
      "blobSha": "194b1ad5962d79617a729c798c6af61bb5d6e260"
    },
    {
      "path": "document-release/SKILL.md",
      "blobSha": "f763918b12999972d335e3aaa5789f71752e41f9"
    },
    {
      "path": "freeze/SKILL.md",
      "blobSha": "f671cb48e339ef208baaa4e2d485a5e3509fc049"
    },
    {
      "path": "gstack-upgrade/SKILL.md",
      "blobSha": "b5ec03d428a9b3d30b4329e3a0fa551afaddfa8a"
    },
    {
      "path": "guard/SKILL.md",
      "blobSha": "7425b789f8f0db3b9f58af0995f66d09b83233ac"
    },
    {
      "path": "health/SKILL.md",
      "blobSha": "bab29e8880d80c1334f84c109f3d6ef425806333"
    },
    {
      "path": "investigate/SKILL.md",
      "blobSha": "31bb0c45ad10abf55909ca145cc1010917b2f115"
    },
    {
      "path": "ios-clean/SKILL.md",
      "blobSha": "8137f20cf03c12442e055ea2d261024ecfd31469"
    },
    {
      "path": "ios-design-review/SKILL.md",
      "blobSha": "e638c3486586cd40f9fb787bd1f903094b26388e"
    },
    {
      "path": "ios-fix/SKILL.md",
      "blobSha": "1142a218e07477d0463de83b25b1a9c9101502e7"
    },
    {
      "path": "ios-qa/SKILL.md",
      "blobSha": "85813ca7e57c9a8c6690ae3b22b14344647876a6"
    },
    {
      "path": "ios-sync/SKILL.md",
      "blobSha": "9d0dcd3a1c09928d5859b2ba5ae2f6da3a8a242f"
    },
    {
      "path": "land-and-deploy/SKILL.md",
      "blobSha": "a6079237d59359ab81dd698a013bacda46c47e46"
    },
    {
      "path": "landing-report/SKILL.md",
      "blobSha": "bf66b9a9e3fd64c07213c20dae54b87e9341923d"
    },
    {
      "path": "learn/SKILL.md",
      "blobSha": "8ec9554e3fdc6ead13a253ed42da9d0ea252e0fe"
    },
    {
      "path": "make-pdf/SKILL.md",
      "blobSha": "b0573679d74dbe466a57d2caea3e924bab1acfb1"
    },
    {
      "path": "office-hours/SKILL.md",
      "blobSha": "4861146f976964e54a123494763bce339a0d2f13"
    },
    {
      "path": "open-gstack-browser/SKILL.md",
      "blobSha": "ba90587963de66aa1b5021630e75958ad42c6964"
    },
    {
      "path": "openclaw/skills/gstack-openclaw-ceo-review/SKILL.md",
      "blobSha": "c0b191cfb5a5d0e7ecd7318df70a2cc0328a1338"
    },
    {
      "path": "openclaw/skills/gstack-openclaw-investigate/SKILL.md",
      "blobSha": "829476f9b3ebc73f0fa7e00e0ec3d7a2e2948264"
    },
    {
      "path": "openclaw/skills/gstack-openclaw-office-hours/SKILL.md",
      "blobSha": "9d52b3134e65a40454d3ee4172910e32cb4aaef0"
    },
    {
      "path": "openclaw/skills/gstack-openclaw-retro/SKILL.md",
      "blobSha": "1e823b3f0936afe054d639cc4f336b475a4e92e8"
    },
    {
      "path": "pair-agent/SKILL.md",
      "blobSha": "2f82460685eef839dbc39585d14c49ed1a1f242b"
    },
    {
      "path": "plan-ceo-review/SKILL.md",
      "blobSha": "995b81375f398e2fc491f513b4dd8f4be43547f7"
    },
    {
      "path": "plan-design-review/SKILL.md",
      "blobSha": "b0e6e43e4414918e84798958547213397d6db943"
    },
    {
      "path": "plan-devex-review/SKILL.md",
      "blobSha": "741f96e51d62b07d57b9064da83cb2f95fb5dbca"
    },
    {
      "path": "plan-eng-review/SKILL.md",
      "blobSha": "4cf4c0e76aa42fb9264ac4bb62e1de1601abe2fb"
    },
    {
      "path": "plan-tune/SKILL.md",
      "blobSha": "f79dd1b35963a1e27c9131df08211627f688564b"
    },
    {
      "path": "qa-only/SKILL.md",
      "blobSha": "48194186d6c06cd50d78e2b90f1bd83a1ab797ce"
    },
    {
      "path": "qa/SKILL.md",
      "blobSha": "5e701891194a9cc2e85563375f337d08b0e41c73"
    },
    {
      "path": "retro/SKILL.md",
      "blobSha": "db308fc022172f054e0e09b764943222dbfd6612"
    },
    {
      "path": "review/SKILL.md",
      "blobSha": "e658574c91897c40e7945ec9d098adfa898bd62e"
    },
    {
      "path": "scrape/SKILL.md",
      "blobSha": "fa2cf4f37559ca6dfac172b36f30a65ace591d87"
    },
    {
      "path": "setup-browser-cookies/SKILL.md",
      "blobSha": "d1fe69ebc8d0a6e5185ce24be5c09452786a4d14"
    },
    {
      "path": "setup-deploy/SKILL.md",
      "blobSha": "9e061383c77ce9214bdccb0dca71708a0d24645c"
    },
    {
      "path": "setup-gbrain/SKILL.md",
      "blobSha": "327184b08ef1ef7b039ab22f8b174f2ed8c4c925"
    },
    {
      "path": "ship/SKILL.md",
      "blobSha": "6c61f37edf1dc8f69537fd400c81db479fba5874"
    },
    {
      "path": "skillify/SKILL.md",
      "blobSha": "a1cdde2c62cc2058ba308bcba90b41bbe25341d3"
    },
    {
      "path": "spec/SKILL.md",
      "blobSha": "6d8d711871eca61559c3b50e7f29380366e2bd40"
    },
    {
      "path": "sync-gbrain/SKILL.md",
      "blobSha": "09a46e1df6af9e610a99224bf54c7d48ca31eae6"
    },
    {
      "path": "unfreeze/SKILL.md",
      "blobSha": "a07f1cf5f7a8e1403714b0b4bbf8c2c1e6bc54a1"
    }
  ]
}
