{
  "pack": "mattpocock/skills",
  "repoUrl": "https://github.com/mattpocock/skills",
  "resolvedRef": "main",
  "resolvedSha": "6654f6b60cd9d5be8b54c6fafe44346dabeb3b76",
  "resolvedAt": "2026-08-26",
  "license": {
    "status": "recorded",
    "sourceUrl": "https://github.com/mattpocock/skills/blob/6654f6b60cd9d5be8b54c6fafe44346dabeb3b76/LICENSE",
    "blobSha": "f1dd2c09108dde1a5f56097cee8461b3ea834499"
  },
  "catalogs": [
    "catalogs/engineering.json"
  ],
  "skills": [
    {
      "path": "skills/engineering/ask-matt/SKILL.md",
      "blobSha": "ae8eb9b211972d9ae584b41d0f1439c644494fc7"
    },
    {
      "path": "skills/engineering/code-review/SKILL.md",
      "blobSha": "e28d7acbf7b3bb4d7817b7eb5d9c105af03f6ec4"
    },
    {
      "path": "skills/engineering/codebase-design/SKILL.md",
      "blobSha": "3f63c8146dd2604b419c929e9876b90c30d410e9"
    },
    {
      "path": "skills/engineering/diagnosing-bugs/SKILL.md",
      "blobSha": "061c25a524acaa93d4534e9e08a793c0a5fe45fd"
    },
    {
      "path": "skills/engineering/domain-modeling/SKILL.md",
      "blobSha": "9b97707e19ef1f590aada356f2b3f6bb881f91be"
    },
    {
      "path": "skills/engineering/grill-with-docs/SKILL.md",
      "blobSha": "62b9efb6f991d1b229adee7506962f13ced0c499"
    },
    {
      "path": "skills/engineering/implement/SKILL.md",
      "blobSha": "7a0b11f5f4fe9505ea5c7983c3083ba1bf754f69"
    },
    {
      "path": "skills/engineering/improve-codebase-architecture/SKILL.md",
      "blobSha": "a578dd0a34ad0a8886abe7e7642b100106ba86d6"
    },
    {
      "path": "skills/engineering/prototype/SKILL.md",
      "blobSha": "a0044501fe0d385b4d8575b610188ede9b236ccf"
    },
    {
      "path": "skills/engineering/research/SKILL.md",
      "blobSha": "fecee97e9457ba039678d2fcf1b1bc9fca78307d"
    },
    {
      "path": "skills/engineering/resolving-merge-conflicts/SKILL.md",
      "blobSha": "bfb7e5606e231e6808979f623fce76a9aad4b71c"
    },
    {
      "path": "skills/engineering/setup-matt-pocock-skills/SKILL.md",
      "blobSha": "7f6f576e2e54e0d287cbb9731ebe0343f54e50cf"
    },
    {
      "path": "skills/engineering/tdd/SKILL.md",
      "blobSha": "8fc086710806190ee7c4baa32089cb877a75736a"
    },
    {
      "path": "skills/engineering/to-spec/SKILL.md",
      "blobSha": "3f52599ae2a4347aee5a07432c2707518e691a7f"
    },
    {
      "path": "skills/engineering/to-tickets/SKILL.md",
      "blobSha": "e868c831fcfb1e124e010bcdf84a429ec879160f"
    },
    {
      "path": "skills/engineering/triage/SKILL.md",
      "blobSha": "37ddea1e3dcf8fb5be5b92e4e45f2c34b8e61d3e"
    },
    {
      "path": "skills/engineering/wayfinder/SKILL.md",
      "blobSha": "812805b760baf328db0ebdef6f3807e381f97016"
    },
    {
      "path": "skills/engineering/wizard/SKILL.md",
      "blobSha": "c4294ad8298b9b95fc727496b1b802b1f7363fba"
    },
    {
      "path": "skills/in-progress/claude-handoff/SKILL.md",
      "blobSha": "9ab14e312a0d5cffe926eeeab12cef7dc8f84d54"
    },
    {
      "path": "skills/in-progress/implement-spec/SKILL.md",
      "blobSha": "d5097f847fc003935599a7f7bf8f0f7186427910"
    },
    {
      "path": "skills/in-progress/loop-me/SKILL.md",
      "blobSha": "e58a474ca80feffdeb28842bc3bdee37da6510e7"
    },
    {
      "path": "skills/in-progress/retro/SKILL.md",
      "blobSha": "f5fed82c7b8597a852a4fa8d292b00a1d5c8bd16"
    },
    {
      "path": "skills/in-progress/setup-ts-deep-modules/SKILL.md",
      "blobSha": "7e30047eaeda175de5d93886596a37baf365bb90"
    },
    {
      "path": "skills/in-progress/writing-beats/SKILL.md",
      "blobSha": "3d3b25b605491adc5c62ae5423127717a94b9632"
    },
    {
      "path": "skills/in-progress/writing-fragments/SKILL.md",
      "blobSha": "c7c889b880cf9c8d289119dea5ff240641b615ca"
    },
    {
      "path": "skills/in-progress/writing-shape/SKILL.md",
      "blobSha": "02f2866d13e72504e010f2ad3458eb9b36b876db"
    },
    {
      "path": "skills/misc/git-guardrails-claude-code/SKILL.md",
      "blobSha": "58bcdd875b164093b95f436fa32a65c6cb5eb572"
    },
    {
      "path": "skills/misc/migrate-to-shoehorn/SKILL.md",
      "blobSha": "ae4f965e204fc93cedbc4e2c306e92829d93f800"
    },
    {
      "path": "skills/misc/scaffold-exercises/SKILL.md",
      "blobSha": "d87df28e7d8abb4e57ecc6e47d71c274d16054c7"
    },
    {
      "path": "skills/misc/setup-pre-commit/SKILL.md",
      "blobSha": "1b9708168263067adb4684d06ebb8f4ccfe9682c"
    },
    {
      "path": "skills/productivity/grill-me/SKILL.md",
      "blobSha": "3947ff9c4ad980d14fc07fccbf659d47c114e81d"
    },
    {
      "path": "skills/productivity/grilling/SKILL.md",
      "blobSha": "8ca78c6d8f901aab0c5a1f896034b70e666ff2a3"
    },
    {
      "path": "skills/productivity/handoff/SKILL.md",
      "blobSha": "2eb98a51b97bb5bac461a26ad14828eeac827909"
    },
    {
      "path": "skills/productivity/teach/SKILL.md",
      "blobSha": "c679eeccd48ca720c8196e5d9a9e58223abf213b"
    },
    {
      "path": "skills/productivity/to-questionnaire/SKILL.md",
      "blobSha": "dadd0c00d6a350acaa15bb9ca1b96b20ead684ca"
    },
    {
      "path": "skills/productivity/wait-what/SKILL.md",
      "blobSha": "f8854f1b4527bca90378baf5430557172136a1bf"
    },
    {
      "path": "skills/productivity/writing-for-agents/SKILL.md",
      "blobSha": "a37608daf6e835e767deecfb498facecaaba82ba"
    }
  ]
}
