{
  "pack": "coreyhaines31/marketingskills",
  "repoUrl": "https://github.com/coreyhaines31/marketingskills",
  "resolvedRef": "main",
  "resolvedSha": "becd60ee9df07f7d595c26e092253ba49f7a9ffc",
  "resolvedAt": "2026-08-26",
  "license": {
    "status": "recorded",
    "sourceUrl": "https://github.com/coreyhaines31/marketingskills/blob/becd60ee9df07f7d595c26e092253ba49f7a9ffc/LICENSE",
    "blobSha": "7c48dd638a9ebed49a8ef0c0c4eea90105381cdf"
  },
  "catalogs": [
    "catalogs/marketing.json"
  ],
  "skills": [
    {
      "path": "skills/ab-testing/SKILL.md",
      "blobSha": "e3f999719ccc2aa408d107d24b3e662b88f079a3"
    },
    {
      "path": "skills/ad-creative/SKILL.md",
      "blobSha": "d2cafa2f4559ff595897e8108df3362e1902403e"
    },
    {
      "path": "skills/ads/SKILL.md",
      "blobSha": "3a06fcda47f69c826b00fc54968e749e91230f0a"
    },
    {
      "path": "skills/ai-seo/SKILL.md",
      "blobSha": "97c5261d4b2caf13fb87c207114e36334ccbe3f6"
    },
    {
      "path": "skills/analytics/SKILL.md",
      "blobSha": "e20a3df64f984d048ab769ec1bb609faf05f8a65"
    },
    {
      "path": "skills/aso/SKILL.md",
      "blobSha": "961bc364429e0571948b4953e23dabab9a25d930"
    },
    {
      "path": "skills/attribution/SKILL.md",
      "blobSha": "6529ae887e34e9175e420dec3b178315c9ab90b2"
    },
    {
      "path": "skills/churn-prevention/SKILL.md",
      "blobSha": "b8fbcd28ebc3942dc557db84b69e233b03c45296"
    },
    {
      "path": "skills/co-marketing/SKILL.md",
      "blobSha": "4d4849476b4128409414700ddd3dd476881f7e6a"
    },
    {
      "path": "skills/cold-email/SKILL.md",
      "blobSha": "9e18b25c3547d9e6c2558d1e78cb982223add86a"
    },
    {
      "path": "skills/community-marketing/SKILL.md",
      "blobSha": "441463df2bd0cd0bc5349f3151e95bc7afad0f04"
    },
    {
      "path": "skills/competitor-profiling/SKILL.md",
      "blobSha": "615aba793ebbcadf1ef69796e6a1edd984381413"
    },
    {
      "path": "skills/competitors/SKILL.md",
      "blobSha": "e919fec899061f3d894c2f0bd6dac98709eeb8e4"
    },
    {
      "path": "skills/content-strategy/SKILL.md",
      "blobSha": "b8a26a008ed59a4eef2b46794be9baeeb7e22d57"
    },
    {
      "path": "skills/copy-editing/SKILL.md",
      "blobSha": "33110f4bb1be5f2152f838d95191705328760ddd"
    },
    {
      "path": "skills/copywriting/SKILL.md",
      "blobSha": "349426d7f1874815401194d642fa59a0bb5b1842"
    },
    {
      "path": "skills/cro/SKILL.md",
      "blobSha": "74a2394f838e0f07a5a5f06eee99047b8a5adcd6"
    },
    {
      "path": "skills/customer-research/SKILL.md",
      "blobSha": "e8571f8b67f3d096718a3607aa67e852a49b74e5"
    },
    {
      "path": "skills/directory-submissions/SKILL.md",
      "blobSha": "9abacadbdca03bb9c72d2232a5e5a0c5de8013b0"
    },
    {
      "path": "skills/emails/SKILL.md",
      "blobSha": "a9b31c79599095f66d9705090a25d877a437a7d7"
    },
    {
      "path": "skills/events/SKILL.md",
      "blobSha": "ca56d1cd1edc7baf05a1cab50f8d56b262fb8f39"
    },
    {
      "path": "skills/free-tools/SKILL.md",
      "blobSha": "ead49b70b42507df7dcc888359e3a9ff906ce16c"
    },
    {
      "path": "skills/image/SKILL.md",
      "blobSha": "4ec01425410a26518a3f6ba8b0b5d8dd9fc85bbc"
    },
    {
      "path": "skills/influencer-marketing/SKILL.md",
      "blobSha": "53066b284b22a3403f04bd72803dc78849e2f975"
    },
    {
      "path": "skills/launch/SKILL.md",
      "blobSha": "9438859e19c1ec10bf07632de1887b789df8761d"
    },
    {
      "path": "skills/lead-magnets/SKILL.md",
      "blobSha": "fc53513f326836381e81a2d4e3e699cdd52f9cbc"
    },
    {
      "path": "skills/marketing-council/SKILL.md",
      "blobSha": "f4737811fb0ef5f2b5d1b51c996d018e9f66607e"
    },
    {
      "path": "skills/marketing-ideas/SKILL.md",
      "blobSha": "c5d681932b8e329236fa9e06fa85d6f5dc632c8d"
    },
    {
      "path": "skills/marketing-loops/SKILL.md",
      "blobSha": "895072416c4c53941d354e48b0bab973f94a3d83"
    },
    {
      "path": "skills/marketing-plan/SKILL.md",
      "blobSha": "4cb30ec952b7d7001d1d81c58583bbde5ddf433c"
    },
    {
      "path": "skills/marketing-psychology/SKILL.md",
      "blobSha": "806c09fba8228e53b9d2443cea7e2bbb104e6ee9"
    },
    {
      "path": "skills/offers/SKILL.md",
      "blobSha": "dac1def431d22858653f41c25fadfa9abb1850e4"
    },
    {
      "path": "skills/onboarding/SKILL.md",
      "blobSha": "e5bfebe9e380888ab09816e00dc94ca45b3eed06"
    },
    {
      "path": "skills/paywalls/SKILL.md",
      "blobSha": "de911a4f39e11b03113f31a96404d06035952d1a"
    },
    {
      "path": "skills/popups/SKILL.md",
      "blobSha": "398b3329e4a7cea4b610edf143a5896466287d51"
    },
    {
      "path": "skills/pricing/SKILL.md",
      "blobSha": "0ea73d15170f969c68f47adaeca9692467d0ec66"
    },
    {
      "path": "skills/product-marketing/SKILL.md",
      "blobSha": "622eab19e823a131fe8b9d500aa53143604fad8a"
    },
    {
      "path": "skills/programmatic-seo/SKILL.md",
      "blobSha": "e96bf82ed07475262490f60108258d8dfccb6389"
    },
    {
      "path": "skills/prospecting/SKILL.md",
      "blobSha": "472435c76bb7c0e03d620b9412994ec016615e42"
    },
    {
      "path": "skills/public-relations/SKILL.md",
      "blobSha": "76fbe11745b68099b4019a35c93d1b259d528791"
    },
    {
      "path": "skills/referrals/SKILL.md",
      "blobSha": "bcd90b1d3d03480ff86dbe914e90f92f7f8673bf"
    },
    {
      "path": "skills/revops/SKILL.md",
      "blobSha": "fba4dc188fa79cc094ba8f3dd878c0791331d1a0"
    },
    {
      "path": "skills/sales-enablement/SKILL.md",
      "blobSha": "19dab426e515b24cf2b540c7feefd5114f66093f"
    },
    {
      "path": "skills/schema/SKILL.md",
      "blobSha": "e6012136a998d5881d320dce58360bac1809b246"
    },
    {
      "path": "skills/seo-audit/SKILL.md",
      "blobSha": "af014ef82989c61a672cdab26cd898821ef9518b"
    },
    {
      "path": "skills/signup/SKILL.md",
      "blobSha": "3ef89f8e51f7a58b3994d2c0bdd8754980425db2"
    },
    {
      "path": "skills/site-architecture/SKILL.md",
      "blobSha": "b7658d5f3035a77be3474be2cf25065e9b6df713"
    },
    {
      "path": "skills/sms/SKILL.md",
      "blobSha": "50cfa8d32c434ca948fecaa596aa5cd23f91d8cd"
    },
    {
      "path": "skills/social/SKILL.md",
      "blobSha": "ab1d083ef4a9dd2a91c1eaedfb5cb745c3055d24"
    },
    {
      "path": "skills/video/SKILL.md",
      "blobSha": "6c8e9fdeb640594d3bf36690174f1726a721c4e3"
    }
  ]
}
